Post Text,Score
"I also dont understand why the question is closed. there is a minimal example, the details are clear. the question is about summing fields in structs that have the same inner structure.",0
"I made the mistake of thinking that fetch request would throw a 404 which technically is not a request error. So, In order to test it, I would have to check the response in the next .then block from the previous when I return response.json().",0
"@ilvar No, I am using cosine similarity between query embeddings and the document embeddings. For my particular use case it works quite well. I am just trying to make sure that when we move to actual production, it's done efficiently.",0
@TheWalrus but it does.,0
You need what is known in regex as &quot;look ahead&quot; or &quot;look behind&quot;. Look it up.,0
Thank you for pointing this out! I decided to use ```RETURNING prc_id``` instead :),0
This is a sure way to trigger the crash mentioned in https://stackoverflow.com/questions/68028285/c-sharp-wpf-datagrid-commitedit-throws-exception-with-value-cannot-be-null-par,0
adding delete if empty isnt setting the cookie at all,0
@chitenderkumar I am looking for something similar. Were you able to figure this one out ?,0
"@user2345, I haven't actually used jQuery before (if that even is jQuery), perhaps you can try adding a return; at the end of the function.",0
"H T:  I used the JS that you suggested, with Removing the other JS that I had, and the mobile nav menu appears to become frozen.  When I use it With the other JS, then it closes the mobile menu Without scrolling.  :--)",0
"At least, please `print(ds)` and give us a more detailed definition of your grid spec including the `x, y` and `lat, lon` coordinates. additionally, you'll need to decide what you actually want to happen when reshaping your data. do you want nearest-neighbor remapping to the new grid? bilinear interpolation? something else? and what do you want your output lat/lons to be exactly? thanks!",0
it says ```No such file or directory``` but i have the file and i can open it,0
Does this answer your question? [Easiest way of using min priority queue with key update in C++](https://stackoverflow.com/questions/9209323/easiest-way-of-using-min-priority-queue-with-key-update-in-c),0
"Updated logs just now. Is there something else I should show to bring more information about my question, don't know if I'm showing you guys the right logs",0
"@EmielZuurbier not sure I understood your question. I am invoking this javascript, which then invokes java classes",0
Does this answer your question? [How to fix: &quot;UnicodeDecodeError: 'ascii' codec can't decode byte&quot;](https://stackoverflow.com/questions/21129020/how-to-fix-unicodedecodeerror-ascii-codec-cant-decode-byte),0
"still button is disabled, When I enter data in the input fields and select Engine Number, or Chassis Number from the dropdown and select the checkbox, the button remains disabled.&#xA;&#xA;kindly help me when the all condition is succeeded the button should be enable.",0
"@shailPatel I see, that means this is due to build package setting in react-native. might need to explore react-native repo with this issue. there could be more details if it is listed as an issue.",0
"what do you mean force them , do you want them to be unique or not? if not  drop unique constraint , if yes then don't insert duplicates",0
"You're misinterpreting that information. The dependencies listed on nuget.org are not an indication of maximum support. It's minimum targeting. The fact that it says &quot;.NET Standard 2.0&quot; means that it can run against .NET Standard 2.0, which is implemented by .NET Core 2.1 *and later*.",0
"Basically `lapply` is doing the &quot;same&quot; as a `for` loop. But it's more concise and especially when working with ggplot2 I would recommend to use lapply. So. What my code does is the following. First I split the data by type, which gives me a list of data frames. Then I use lapply to loop over this list, which means apply the plotting function to each element (i.e. dataframe) in the list. As a result we get a list of `ggplot´s for each type, which finally is passed on to `wrap_plot` which glues the plots together.",0
Where is the Traefik service ?,0
Could you please refer this doc(https://learn.microsoft.com/en-us/graph/api/resources/chatmessagemention?view=graph-rest-1.0) and check if it helps,0
"Info on [require-trusted-types-for](https://developer.mozilla.org/en-US/docs/Web/HTTP/Headers/Content-Security-Policy/require-trusted-types-for), it is a relatively new browser feature not supported by all browsers. Probably it is not supported by whatever version of WebEngine you are using.  You should try the latest JavaFX early access release to see if it still gives the same message, if it does you can create an issue report for the openjfx project.",0
Thank @JohnHanley! I'll update my answer.,0
Why try to filter report in it's load event? Add the additional filter criteria to the OpenReport command.,0
@MattDMo the `%` operator for format-strings has been de-emphasised. https://stackoverflow.com/a/13452357/9946987,0
Both editors says that the file is already encoded utf8 (`Emacs:  Its value is ‘utf-8-dos’`),0
And `__str__`/`__repr__` so it &quot;looks like&quot; the answer.,0
check out [fetch()](https://developer.mozilla.org/en-US/docs/Web/API/fetch),0
point 3 (restart server) fixed mine! Thanks!,0
"The truth is that neither `Blog.Posts` nor `Post.Blog` nor `Post.BlogId` **property** is required in the entity classes (as usual @Serge is mixing class with database table). But they are good to have, especially navigation properties.",0
@Emil105 You mean measure execution time inside my_pow function and return time and res?,0
"Map has 3 template parameters, neither of the operator&gt;&gt; overloads is suitable.",0
Updated code to include what i tried and error,0
"Also, in the `list_move` call, you should be moving `tmp_list.next`, not `&amp;tmp_list`. (`&amp;tmp_list` points to the control node. `tmp_list.next` points to the first node.)",0
"Please provide minimal reproducible example, what you showed is not enough for us to understand the underlying issue",0
Looks a bit like [XY problem](https://xyproblem.info/). Can't you solve it by checking the `&quot;error&quot;` value ([doc](https://www.php.net/manual/en/features.file-upload.errors.php)) when processing these?,0
"try also with exclude=['',''] instead of fields='__all__' with null=True  and blank=True sepcified",0
"@GaneshBudhathoki this was my mistake when i removed the url from the example, i have fixed it, thanks",0
"I haven't had the time to make the comparison one-to-one. However, at this point, I can confidently say that the metal implementation does not present the issue, even for very long exposures. This was also confirmed by all my beta testers. There seem to be some problems with Core Image for this particular case...",0
"@JonasLevin I'm not sure, never face this issue before. https://stackoverflow.com/questions/31683788/android-manifest-attribute-not-allowed-here follow this answer here, it look like a IDE error. please try to invalidate cache and restart Android Studio to see if this problem still happened",0
"What were you **expecting** `int('A')` to produce?  Or `int('a')`, or `int('&amp;')`?",0
Thanks for your valuable comments.,0
"I'm not very familiar with C#, but my guess is C# would probably require API Access and authentication. I personally feel JavaScript is simpler and its an inbuilt feature in Google Sheets. So you'd find it more seamless.",0
"You only give a value to `temp-&gt;next` when `head` is not NULL.  To be correct, the code must always set `temp-&gt;next`. The easy way to do that is to remove the whole `if` statement.",0
"My bad, it is not api call via cloudtrail. I guess i wasn't able to edit the detailt type upon exploring. However i solve the problem by adding this&#xA; &quot;source&quot;: [&quot;aws.secretsmanager&quot;]&#xA;on event pattern. Thanks and I appreciate your help!",0
"`import 'package:flutter/material.dart';&#xA;import 'package:auduo/login_Screen.dart';&#xA;import 'package:auduo/register_Screen.dart';&#xA;&#xA;class AppRoutes {&#xA;  AppRoutes._();&#xA;&#xA;  static const String authLogin = '/auth-login';&#xA;  static const String authRegister = '/auth-register';&#xA;&#xA;  static Map&lt;String, WidgetBuilder&gt; get routes {&#xA;    return {&#xA;      authLogin: (context) =&gt; Login(),&#xA;      //(context) =&gt; Login(),&#xA;      //authRegister(context) =&gt; Register(),&#xA;    };&#xA;  }&#xA;}&#xA;`",10
"Well, to put you on the right track, you could get the max value with `max` and a generator expression.  `max(item[&quot;value&quot;] for sublist in data for item in sublist if isinstance(item, dict))`",0
"I'm not an expert on textures, but they are closely linked to opengl. It's possible that you shouldn't use static initialisers like this to create textures, perhaps some aspects of opengl need to be initialised first. I would recommend moving your initialisation of catTexture into the create method of libgdx and see what happens. In fact, initialising textures this way is bad for many reasons, I suggest you read about opengl context and the lifecycle of an android application.",0
I am using the 9.2.4 library - let me dig out what is the version of the third party server,0
@A.H.Wegemoed so if it's external lib for exemple you can use redux to save your count everyTime you execute the increment the new result must be saved in store and your component must be connected to this store and read the latest value everytime there is a change,0
"Thank you for you answer. Is using `LiveData` the recommended way though? With Jetpack Compose, I feel like I should be working with `State`s and `Flow`s and stuff. Maybe I'm wrong though. But I know that `LiveData` is used even if you don't use Jetpack Compose.",0
"I changed the answer with some Java to create the view with the background. I wouldn't create the layer-list in code, but leave it as an XML drawable. Usually, a _View_ has to be added to some _ViewGroup_ to be useful, but maybe you have another use.",0
"If you can install Modules, I would take on this module https://www.powershellgallery.com/packages/SqlServer/21.1.18256",0
I suppose it counts the `||` as two possible control flow paths.,0
SLOW is not the problem I want to solve here ... I want to fix the `Type Error`,0
"A lookbehind `?&lt;=` only allows for fixed-width patterns.  If you have one, this is a good option.",0
It's not on security.ubuntu.com either. I guess it was a bad version.,0
I already setting folder storage for user 'IUSR' full control,0
tried but still same issue,0
This line of code in my answer adds the entered value (i.e. `side`) to the current value of `perimeter`: `perimeter += side;`,0
"Ignore that above, wouldn't let me edit it....&#xA;&#xA;Here was another go at it:  Changing the top of `AdminMixin` to&#xA;&#xA;`function AdminMixin(M: typeof Model) {&#xA;	return class Admin extends M(['can_delete']) {&#xA;`&#xA;&#xA;Now only results in a runtime error of &#xA;&#xA;`&#xA;TypeError: Class constructor User cannot be invoked without 'new'&#xA;`&#xA;and this seems to be a possible problem with babel and using older target ecmascripts.  I have specified es2020.",0
This loads the whole file. It's not answering the actual question,0
"yes when I print it, it is empty. I added [2:1], because the error before that was : InvalidArgumentError:    Specified a list with shape [2,1] from a tensor with shape [32,1]&#xA;	 [[{{node TensorArrayUnstack/TensorListFromTensor}}]]&#xA;	 [[functional_5/lstm_4/PartitionedCall]] [Op:__inference_predict_function_14267]&#xA;&#xA;Function call stack:&#xA;predict_function -&gt; predict_function -&gt; predict_function",0
"@user11448245 The &quot;why&quot; question has been answered by two users in the comments. As to the other question, there you go: `temp.GetType().GetInterfaces().Any(t =&gt; t.IsGenericType &amp;&amp; t.GetGenericTypeDefinition() == typeof(IEnumerable&lt;&gt;))`. This is a slightly modified version of the code in the answers to the duplicate. That's why you should read the answers and try to understand them before you can determine whether or not they solve your problem.",53
Has this been solved ?,0
I have edited the question and put in the code that i used to indicate the string i am sending and the results from dumping the packets being sent.,0
Have you tried using typed holes? `instance Functor (LiftItOut f) where fmap f (LiftItOut x) = _1` should give you a helpful message. (Note: you'll have to make a change beyond filling in that blank; follow the error messages.),0
"Looks great, really appreciate it. Thank you.",0
"If you defined `d$Flag&lt;-&quot;&quot;` at the start, it avoids the need to clean up the NA at the end.",0
Why not to get env_vars directly from secret from key vault? Like [in azure documentation](https://learn.microsoft.com/en-us/azure/aks/csi-secrets-store-driver#set-an-environment-variable-to-reference-kubernetes-secrets),0
"Nowhere in my example is assumed that more data will be returned. I don't see what won't work though, if you could be more clear?",0
"What are you trying to do here? Is it like a carousel where you're just rotating through the cars, and when you get to the end of the array looping back round?",0
no i did not try,0
welcome :)if its work please vote up my answer.Thanks.,0
try with {% load static %} instead of {% load control_static %} also change the 'control_static' to 'static' in the &lt;a&gt; tag too,0
"@9769953 I don't claim it, my school provides a testing framework that tests random lists. This is the error the framework gives me.",0
After trying that I'm getting this error in the console TypeError: Cannot read properties of undefined (reading 'id'),0
"Thank you, and is there any better way to go about this, say in CSS, or just in Javascript in general",0
"What is the best practice for handling user/group ids in a container? I had situation just now where my Docker's user was root with an id of 0 and when I created a file within a filesystem that was mapped with the host, that file was owned by root on the host. The container was spinned up by a user however. I consider that dangerous, at the same time, docker/host user/groups have always been poorly understood, at least by me, and I would like to get better at this because it causes problems in more situations than I'd like count.",0
When I am sending new author in json object It is working fine. But If I am sending id of already existing author in json object I am getting persisting exception,0
Is it recommended to edit files that come directly from bootstrap? That is files with the prefix underscore ( _ ).,0
"So consider, `print(f&quot;{'foo'!s}&quot;)` and `print(f&quot;{'foo!'r}&quot;)`",0
"If you divide A, B, and C by the numbers in this list [0.1 , 0.5 , 1 , 1.5], you will get an integer. I am trying to code a solution to be able to find such a list in python. Optimally, the numbers in the list should be well spaced. I came up with a solution that is working pretty well till now, you can check it below.",0
I looked the answer mentioned by you. my program goes into debug  mode,0
"You are right, thanks, I do not know, will edit.",0
Thanks @dgruending ! This solved my problem.,0
"Basically a solved problem, see https://stackoverflow.com/questions/2799078/permutation-algorithm-without-recursion-java for example.",0
any updates regarding this question? I have the same requirement,0
It is an ODBC Database Query connection in my excel file.,0
"Unfortunately I don’t remember.  But since then, I’ve shifted to using unit tests primarily, due to this and other difficulties.",0
"No, the setTimezone function adjusts the display timezone of a particular datetime object. It is not a global setting like your Laravel configuration. Take a look at the setTimezone documentation in the answer and you will see that it does literally exactly what you are asking for.",0
"also, are you positive the json you submit in Postman matches the json you are submitting in C#?",0
"It should. See also the discussion here: [link](https://stackoverflow.com/questions/16982144/cmake-and-generateexportheader). If it's really only a header file, you can also consider adding it to your other source files in the `CMakeLists.txt` file as an alternative.",0
"IIS needs admin privileges to setup, and parts of it run as Local System",0
"it says it's deprecated, any update on the new way ?",0
"I meant it was unrealistic because of the `where` conditions testing for random strings lol. I want to implement a distributed peer-to-peer database, with support for SQL-like queries across browsers, iPhones, etc. devices, so I need to know how to _implement_ a SQL sort of relational database. This is just one small slice to the puzzle.",0
"Most likely you are opening a text document, .csv or .txt.  you need to use the wizard/power pivot to import the document and make the column Text before opening.  Just opening the text file, Excel will try to convert anything that looks like a date as such.",0
"@Meet Your question states that you are looking for a way to NOT close the browser window when the Selenium script ends. I stated not to quit/close the driver to prevent the browser window from closing. Your response to that is referring to not wanting a particular window to display??? I'm confused as to what you are actually asking. If you are trying to ask a new question, clarify what you are asking here and then create a new question for the second question.",21
@ZAY are there no benefits that we get for a system service by running it in elevated mode ?,0
"What happens when you use the second block (the one that uses the `DefinePlugin`? According to the guide, setting those boolean flags explicit should allow tree-shaking: https://vue-i18n.intlify.dev/guide/advanced/optimization.html#reduce-bundle-size-with-feature-build-flags",0
Maybe [Has Many Through](https://laravel.com/docs/8.x/eloquent-relationships#has-many-through),0
This is the answer. Just what I wanted. Can you answer so that I can mark it? @MashedSpud,0
could your provide the explicit expected output dataframe that matches the example input?,0
"Run the code `flutter clean` inside the root folder of the project that is using the plugin. After that, run the project that is using the plugin. I updated the question with more details and also pointed out to a Github repository that shows this working.",0
StackOverflow is for programming **questions**. This is not a place for submitting any kind of bug reports.,0
is it better now?,0
"I understand, I kept the most imporant one",0
"@MartinCostello I posted the action YAML, please take a look and let me know if I'm doing something wrong.",0
"Are you saying you want a list of dependencies for a specific model? So like a list printing out x, y, and z?",0
yes my mistake I've made corrections thanks,0
"Well, we always tell people they should be using a real XML parser, not some hand-crafted approximation. You should tell your 3rd party consumer the same thing. XML is about standards: if you don't follow the standards, you don't get the benefits.",0
@MuhammadUsman Did it help?,0
and how do I draw a rectangle around it?,0
You only need a CLIDRIVER when you do __not__ already have any Db2-client (or Db2-server) installed locally on Microsoft-windows.  If your Db2-server is remote (or in a container)  then you need  `ntx64_odbc_cli.zip` . If your Db2-server (or db2-client)  is running on the same hostname as PHP then its directories need to be on the PATH when php runs.   You can use `php -m | find /i &quot;ibm&quot;` to see if the db2 interface module loaded.,0
"Thanks for the quick reply.&#xA;&#xA;I attached the code.&#xA;According to the Shopify doc, it should send a POST request to the promtions point",0
"You could use identity server or Azure AD to achieve your requirement. For example, you could ask a token from the identity server or AAD provider, then this token could access all the projects which the AAD or identity server has protected.",0
"In our case, AGP 7.1 with Hilt 2.3y.z failed. Bumping hilt to 2.4y.z fixed our issue. Thank youuu",0
But how do I use it to fetch the URL in the code? Can you please describe with an example?? @Gabriel,0
I don't think `.*` would be correct here as it's under-constrained and would include more characters allowed by the question.,0
"@KnowledgeMan `dev` currently has 4 commits. Sounds like you want 2 commits there. What do you want your commit message to be for the second commit? You have &quot;Import the whole web app from external source&quot; and &quot;Modify the Profile&quot;. Are you sure you want to even squash those together? Maybe what you want is 3 commits? Also, the merge commit about the PR isn't necessarily bad to keep around either. In my projects I keep those on purpose. Then someone could go look up PR #1 to see the code review comments and discussion, and previous versions of that branch before it was merged.",0
"Sorry, I'm not sure I understand. With the implementation of changing max height, will you produce the behaviour I want (i.e., animate the shrinking/expanding behaviour of the flexbox itself)?",0
Did you try the guest:guest default user? I also second the call to use `kubectl port-forward`.,0
Are you setting up any queues with tez.queue.name when running queries? is your yarn default queues set up?,0
You can use: ```studentl.innerHTML = JSON.stringify(student);```,0
Can you please elaborate by writing a code bro. Because I cannot understand what you are saying. Actually I'm a beginner in vb.net,0
"@richarddec I think your changes had the desired effect, but portInfo is now no longer a list after appending my results to it. I have added a new section to the question",0
"$(document).ready(function () {&#xA;$('#datatableid tbody').on('click', '.updatebtn', function() {&#xA;&#xA;$('#updatemodal').modal('show');&#xA;&#xA;$tr = $(this).closest('tr');&#xA;&#xA;var data = $tr.children(&quot;td&quot;).map(function() {&#xA;&#xA;return $(this).text();&#xA;&#xA;}).get();&#xA;&#xA;console.log(data);&#xA;&#xA;$('#update_id').val(data[0]);&#xA;&#xA;$('#date').val(data[1]);&#xA;&#xA;$('#time').val(data[2]);&#xA;&#xA;$('#username').val(data[3]);&#xA;&#xA;$('#contact').val(data[4]);&#xA;$('#bookpet_id').val(data[5]);&#xA;$('#service_id').val(data[6]);&#xA;$('#complaint').val(data[7]);&#xA;$('#status').val(data[8]);&#xA;});&#xA;});",61
It should print 5 all the time ... why does this not clue you in on what is wrong?!?,0
If you use publish/subscribe patter you can check [this example](https://catchts.com/publish-subscribe),0
"Note that however you do this, the numbers are stored as type `character` and the leading zero will be lost if you force them to be numeric.",0
remove const before TextStyle,0
Never mind! They seem to work now...I even made an issue of it on another repo! https://github.com/arshadkazmi42/first-issues/issues/87,0
"&quot;When I enter &quot;dashboard&quot; which is a private route it redirects me to &quot;login&quot; first then to dashboard.&quot; - How is this a problem? This is how route protection works. If unauthenticated you get bounced to your auth route, authenticate, and redirect back to the route originally being accessed. What other than this are you expecting to occur?",0
This will execute more than once if you use the android:process tag in your AndroidManifest.xml See https://stackoverflow.com/a/3951911/1549046,0
I think that will fill your needs.,0
the outer part can have one children. within children can have one one or two levels of children.',0
"&quot;Top 4 values is 3,4,2,5&quot; there is no way to get this order with this sample data, try to improve your question",0
"No problem, and welcome to Stack Overflow! Feel free to mark this answer as correct, and I hope your bot does well! ",0
"The path was a typing error, i edited it",0
Sounds pretty similar to this - https://stackoverflow.com/questions/40571876/getting-second-and-third-highest-value-in-a-dictionary,0
"@danh: That’s not correct, although it’s easy to get that impression because people like to make useful correct statements rather than just technically correct statements.",0
"@matszwecja, in this case, for the defaultdict, no lambda function would be needed, simply switching to `from collections import defaultdict` and initialize as `counts = defaultsdict(int)`. It seems to be a matter of preference, here, since it works very much alike `Counter`",0
"Sorry, that does not make sense to me. That is not how a time-indexed scheduling model works.",0
"Already tried, and I get:&#xA;&#xA;`AttributeError: module 'snakemake.workflow' has no attribute 'basedir'`&#xA;&#xA;or&#xA;&#xA;`NameError: name 'workflow' is not defined`",100
Does it matter that these are on different servers and I have basic privileges on db2? Because I'm getting an error::: Invalid object name 'DB2' :::&#xA;after the 'FROM' keyword,0
"Interesting, I thought the token would work for both since I configured permissions for both? How do I tell it I want a token for my backend api &amp; not graph?",0
Was hoping for the page to submit user input into my views.py file,0
"I have both in the second node.js, a route for / ( just in case ) and a route for /crypto",0
"The checkmark and `x` are ASCII, fortunately.",0
"But the problem is that my class (CInteger) is not castable to Enum, how is this going to help? I've tried it anyway and the error message is the same",0
@Barmar&#xA; I turned off all firewall setting. may I know how to allow 13000 port only in firewall. can you tell me the steps in firewall please.,0
