Post Text,Score
"@user3419297 So like, &#xA;InputBox, UserInput, NoteType, Enter What You Want To Type., , 640, 480&#xA;if ErrorLevel&#xA;    ExitApp&#xA;else&#xA;    Run Notepad&#xA;    WinWait, Untitled - Notepad, WinText, 1 [, ExcludeTitle, ExcludeText]&#xA;    WinActivate, [ Untitled - Notepad, ExcludeTitle, ExcludeText]&#xA;    WinWaitActive, [ Untitled - Notepad, 1, ExcludeTitle, ExcludeText]&#xA;    Send %UserInput%",0
"You are storing a Student, (which auto generates an ID), that is fine.   However how are you storing a Subject?  Your JSON has no idea about the student relations... and I am not seeing how you are Creating a Subject, associating (Students) to it, then saving??  The Subject has a mapping to Students, by ID.   How will Subject know which Students to store??",0
Does this answer your question? [How to go to the current breakpoint in Chrome console](https://stackoverflow.com/questions/30621661/how-to-go-to-the-current-breakpoint-in-chrome-console),0
"The use of latin1 is because there will be a need for teachers to use accented letters, for example, ä or ü. As far as the multiple columns are concerned, I have no option. That is how the document owner needs it. These teachers have a format required by their district. Although, when I compile it, it looks fairly close to what I need. The only issue is I need the 5 parts of the lesson plan separated from &quot;Lesson Activities&quot; by a vertical line.",0
"How are you applying the &quot;RateDate&quot;, i.e. is it meant to be an effective date?",0
First make sure to do NOT use the timer to measure elapsed time. Only use it to update the user interface. 1/30 of a second should be enough for displaying purposes.,0
`:nth-child` is a valid and working selector in `querySelector`.,0
"I cant' see any notable difference. Certainly both calls to setup the message scheduler are the same. I forked the sample and stripped it back so it all it did was make a request after the OrderSubmitted event. I sometimes got a skipped canceled message but not reliably, but then I noticed another problem where, after Foo.Completed fires, Foo.Timeout then fires as well. 100% of the time. https://github.com/MassTransit/Sample-AzureServiceBus/pull/1",0
It also works with 'de-AT' btw ;),0
It is an array so you can convert it to collection by gson or jackson,0
"Oh, you just copy it over. I don't think there is another way of &quot;moving&quot; it.",0
"extract the date from the orer date, extract the hour from the order date, group by the date and the hour, count the sales",0
"Yea strange for sure. Might you be willing to connect with me perhaps via live-share maybe?  It's a visual studio code ext for allowing collaboration, &amp; working on code with others in real time.",0
"Do you specifically need to extract them from the list of strings? You could, as an alternative, just return the value of `item_qty_float` from your function, as well.&#xA;&#xA;If you change the return statement and the line calling your function to these:&#xA;&#xA;`return item_str, item_qty_float` and&#xA;&#xA;`item_string, item_qty_float = add_item(user)`&#xA;&#xA;then you have it available as a variable outside your function and can just add it to a total.",0
could you show the raw file `year-temperatures.csv` or a part of it?,0
"If you don't want to return a value to the caller in the failure path, you also can rethrow the exception.",0
"Sorry @jonas, try now?",0
"`pwd` output: `/home/ubuntu` , `ls -l` output: `total 0`.  My teacher helped me with yml file. So he told me what I should include, theres no preceding checkout step",0
"@chicagobeast12 Then you should take my answer. `.equals()` adds burdens to comparing the values, but what you just need is to compare the identity.",0
@MathiasR.Jessen Sure,0
here is a screenshot that shows what each line can look like&#xA;https://ibb.co/jfMNV0g,0
Hey @TenDigitGrid you can easily do that using android studio.&#xA;Open android-&gt;app-&gt;src-&gt;main-&gt;res and there right-click on res folder and then select New and then select Image Assets then you will get image assets configuration wizard. Their click on source asset path and select your icon their you will get all sorts of differrent configuration for your icon,0
I did exactly the same thing and it is still giving me the same error,0
"@EricPostpischil the units _are_ given in the question: &quot;The time is given in hours, the distance in kilometres and the speed in kilometres per hour.&quot;",0
@MohamedChiha What password policy are you trying to enforce? And what makes you think you need lookbehind for that?,0
"Sorry I think I might be explaining it poorly. In-app purchase content would be the additional content you can buy. After its purchased, ideally Internet would not be required for booting up the game. It would simply validate the purchase and extract it into the app. Or do you mean that the Addressable file would only be updated on purchase?",0
it is currently shared with a few users,0
"You would have to check with Stripe, whether they _offer_ such a re-sending of failed webhooks ...",0
"There are many tips in [Python plotly: Dates in other languages](https://stackoverflow.com/questions/32361113/python-plotly-dates-in-other-languages). How about using a graph object, for example, to convert x-axis tick marks from existing data? `fig = go.Figure(go.Scatter(mode='lines', x=[d.strftime('%a\n%H:%M') for d in df['Time']], y=df['value']))`",0
@PeterCordes I am sure I am missing something. But the case you mentioned could easily happen in protocols like MESI since MESI (or other protocols based on it) do not wait for acknowledgemnt of invalidate message (I have never read about acks in MESI like protocols hence this is my belief) e.g. A and B both update memory location x and x + word_size respectively and both simultaneously send invalidation messages. How is the problem solved in such protocols?,0
"@jarlh that worked for me, can you post it as an answer so I can give the point to you, thanks",0
Yes store it in String[]  and use the split function wisely. You are good to go!,0
Please add expected output of html and css.,0
See the basic structure here.  https://dba.stackexchange.com/questions/301903/recursive-query-on-a-self-referential-table-where-each-node-has-one-link-to-its,0
"That would fail with 2 equal buffers but the first 2 bytes. For example, if one buffer has the first two bytes being `2, 13` and the second buffer has the first two bytes as `21, 3`, it will render the same string concatenation. You must differenciate them somehow. The `fromCodePoint/raw` methods are not bugged like this one as each one is a different character.",0
"Fwiw, I corrected the two mistakes I mentioned above and started it with an argument of `3` (as suggested by the comment in `main`) and then it ran and printed `I'm process 0` `error recibiendo mensajes: Success` `Semaforo liberado.` `Buzon liberado.` `I'm process 2`. The whole thing took 10 seconds, which seems reasonable since you have a `sleep(10);` in there.",0
Or use a recursive function instead of a for loop.,0
Az PowerShell module version is 5.1.2,0
it change the whole add name,0
"For what it's worth: there is a log feature using [sysprop `javax.net.debug=ssl:handshake`](https://docs.oracle.com/en/java/javase/17/security/java-secure-socket-extension-jsse-reference-guide.html#GUID-31B7E142-B874-46E9-8DD0-4E18EC0EB2CF) (possibly add `:trustmanager` if it appears not to be using the correct truststore) (the colons aren't required but help readability). This will produce _lots_ of output, which must be kept secure because it contains key-gen info that would enable a wiretapper to decrypt your/your user's protected data. Is that risk worth it? Your call.",0
Does this answer your question? [How to read multiple lines of raw input?](https://stackoverflow.com/questions/11664443/how-to-read-multiple-lines-of-raw-input),0
I think what you're looking for is in the win32_networkadapter class...the interfaceindex will (should?) match what you have in the win32_networkadapterconfiguration class.,0
"@ahmedosama I'm glad I could help. If my solution has solved your problem, please be free to click the checkmark next to it and [accept it as the answer](http://meta.stackexchange.com/a/5235). This lets other users know that your question was solved and awards us both a reputation bonus.",0
"Oh, thanks I'm cured. Now is there a workaround or will I need to figure it out myself",0
"I meet the same problem using axios from vuejs and when I check the routes  with php artisan route:list, the /sanctum/ is not removed and the route is sanctum/csrf-cookie ..... Laravel\Sanctum › CsrfCookieController@show. I don't see any reason why it is not found.",0
"@TimRoberts, this is not how minimax works, it will play the best move given the current board state. In Tic tac toe you can also get each possible outcome of the game so if there is a win the AI should play the move leading to it (given best possible play from the opponent).",0
"Including the `#include` directive in both files (client and provider) warrants that the definition in provider module and client module **is exactly the same** (for example, you defined the `init_client()` using an empty parameter list, which means _undefined parameter list_, not an empty one --- which is defined specifying `void` as the parameter list)  That approach ensures that if you change one side only, you'll get an error.",0
"It has to be the database name, not schema name. I think you can check thay via meta-command `\l`",0
It's best practice and everything can be configured. It is not necessary but suggested.,0
"Can you provide simplified version of code, it is missing widgets like `CustomCheckboxTile` and `SimpleDialog`",0
Thank you. This looks like what I am looking for. Do you know anywhere in the Android documentation that suggests to use AssertJ?,0
"Im not sure but I think you mean to join requirements table (Requirement::class, 'req_id`) in the requirementsDefinition relationship..",0
@AdrianMole so should I just use calloc and set them to 0? Does it really matter if I set the bytes immediatly after that?,0
"I'll describe what needs to be done. Anything that can be integrated into a java (or objective c on iOS) app, can be integrated into a Maui (or Xamarin) app. For Xamarin, this requires mostly code in platform-specific (Android) project. For Maui, the equivalent is code wrapped in `#if Android`, that implements a custom handler. Someone needs to take the source code of that Xamarin Mapbox nuget, and change the xamarin custom renderer logic to Maui custom handler logic. ...",0
welcome. you might want to check out the argparse library. https://docs.python.org/3/library/argparse.html it is build for your use case,0
"@codeling writing questions/answers to get points isnt something bad, is it ? ;)",0
The point of a method that doesn't return a value is to rely entirely on the side-effects of that method - like writing the `Console` (as per your example) or saving a file as a another example.,0
This question is a strong indication that you need to find a basic SQL book or tutorial. What you're asking to do should be something that is covered in the first chapter or two of that tutorial or book.,0
"Sorry, what the... it worked indeed, does anyone know what is the deal? I even restarted VS, the problem was still there, so maybe it is a Windows issue as someone mentioned above. Still, I am dying to figure out how pressing Esc solves it... I am stunned.",0
"&quot;*In your example both for loops will cause an errors*&quot; no they don't: https://jsbin.com/xesagom/edit?js,console the syntax is valid as is the operation.",0
"The &quot;newer&quot; version (LibreSSL 2.8.3) actually comes with macOS out of the box (note that macOS switched to using [LibreSSL](https://en.wikipedia.org/wiki/LibreSSL) some time ago). I personally, not to interfere with the macOS default LibreSSL installation, just installed the latest `openssl@3` package and made an **alias** in my [`~/.zshrc`](https://superuser.com/questions/886132/where-is-the-zshrc-file-on-mac) file like this: `alias openssl3=/opt/homebrew/opt/openssl@3/bin/openssl`. This way I can use it separately by executing `openssl3` and leaving the default macOS OpenSSL version intact.",61
"@ChristianGibbons So you mean each of my thread maybe read and write to memories which are located close, and it might occur false sharing problem?",0
Because those two queries purpose are different,0
5xx is a server error. Contact the dev of that site.,0
"This implementation as expected retrieves every item, but what I need is to list only 1 time every distinct item, let’s say I have 2 items with category: FOOD, I need that my recyclerview only show 1 row and with the total amount of those two items. So I guess some logic need to be in place in the adapter but I am stuck, not sure how to do it.",0
"`select(train, where(~any(x&gt;0)))`",0
It returns miniconda3\python.exe,0
Do not tag both C and C++ except for questions about differences or interactions between the two languages.,0
Thank you. This is working now on my end but im having difficulties applying it on RBF. this is very useful and convert dynamically to fetch json objects with different files and ids.&#xA;&#xA;Was uing the regex one,0
Try the code I put in the answers @Joseph,0
Try arma:: instead of aram::?,0
"Exactly, this is my exact reason for googling this. I need a way to stop cookies being shared so that I can use the same browser to handle multiple &quot;projects&quot; on behalf of different &quot;clients&quot;. The only thing I can really think of is making specific google accounts for each client and then switch between the accounts as I need. This in theory should solve the problem but it's just a bit of a pain.",0
@duxfox-- Yes ! I want it to follow the width of the line because I'll add a data in the box (for example 75%),0
For the third try to use array.last it will get the last element on array,0
"My assumption was that each record would be entered one at a time, I can see that's not how the SO has specified the question.",0
Are you aware of the IF-function? https://support.microsoft.com/en-us/office/if-function-69aed7c9-4e8a-4755-a9bc-aa8bbff73be2,0
The read string will be `This is a string\n` whereas I wanted it to be `This is a string`.,0
Can you explain why you don't start your application via your IDE?  What kind of servers do you start...give more detailed information about the project...,0
"It looks like you want `int(*arr)[4] = new int[8][4];` (or simply `auto arr = new int[8][4];`) or perhaps you want `int[4][8]`, it's hard to tell. But you could also wrap a `std::vector&lt;int&gt; arr;` in a class and add `int&amp; operator()(size_t y, size_t x) { return arr[y*x_size + x]; }`",0
Does this answer your question? [Timeout function if it takes too long to finish](https://stackoverflow.com/questions/2281850/timeout-function-if-it-takes-too-long-to-finish),0
I tend to use SQLite for persistent data storage these days. Come up with a table to store all the relevant data and functions to serialize/deserialize,0
Does this answer your question? [How to write a trait bound for a reference to an associated type on the trait itself?](https://stackoverflow.com/questions/50090578/how-to-write-a-trait-bound-for-a-reference-to-an-associated-type-on-the-trait-it),0
Please share your images if you'd like some assistance - else we don't know what you are referring to. Thank you.,0
I think https://stackoverflow.com/a/55528895/25071 has the info you're looking for.,0
"`createQueue` is only creating a JMS reference to an existing IBM MQ queue.   You could use PCF or the REST API of MQ to create the queue on the queue manager.   You could use temporary dynamic queues with `createTemporaryQueue` which would go away when your connection closes, that is mentioned further down the page you linked to.",0
I think you should use CodeReady Container instead of minishift.&#xA;https://access.redhat.com/documentation/en-us/red_hat_codeready_containers/2.0/html-single/getting_started_guide/index#macos,0
So I am very new to this. Is there a video to show this?  I copied your script and pasted in script editor. added datavalidation and when I run script I get error.        https://prnt.sc/Itb6ovxZyecR,0
"Thank you @CoralSoSupport, I understand current status of Mendel OS. I'll try above links to verify Edge TPU support.",0
"Note that IEEE-754 was updated in 2008.   The major changes related to floating-point decimal arithmetic, though there were probably other cleanups.",0
"Well, &gt; 0 means the code must account for it. :-) Can you share the `PIVOT` query that gets your intermediate results?",0
"Seems strange that the PaymentIntent object would move to the next step, but the frontend gets an error. Probably worth writing to Stripe's support team with the full details(the exact PaymentIntent used and details on the card used) to look into it",0
"Just put the `#status` change handler _outside_ of the AJAX callback, before you even make the AJAX call ...?",0
"@Barmar I'm not sure that the &quot;display from a GUI debugger&quot; added anything useful here, and hiding the code behind a remote image means that this question will become meaningless when those links expire. It also makes the question inaccessible to anyone accessing the site using a screen reader or other assistive device.",0
"Meanwhile, someone else has fixed the problem for you. My previous comment applies to [revision 2](https://stackoverflow.com/revisions/72050092/2) of your answer, in which several `*` characters are not being printed, because they are being interpreted as formatting characters.",0
With that I would have to create examples manually for each type of my schema? (PS: note that Swashbuckle.AspNetCore.Examples is deprecated and was replaced by Swashbuckle.AspNetCore.Filters),0
@questioner: There's general purpose registers and often there's special purpose registers for all kinds of things. Some special purpose registers may be restricted in various ways (potentially including not being able to store them to RAM); but this all depends on what the CPU manufacturer felt like providing (software can only decide how to use what the CPU manufacturer provided).,0
"process = relationship(&quot;ClientModel&quot;, back_populates=&quot;tasks&quot;) -&gt; you've used &quot;ClientModel&quot; everywhere and not the actual class you're referencing (this is an SQLAlchemy question, not actually FastAPI). I'm guessing it'll work as soon as you change to the correct class name in your `relationship` definitions.",0
ie you could ido `use polars::export::rayon::iter::ParallelIterator;` and then replace .into_iter() with .par_ier() ... do you think such parallisation would be benefitial for performance?,0
"did you try with other type of image - i.e PNG, JPG ? Did you try with image on other server? Maybe it doesn't allow for links to discord.",0
"Thanks, I tried that as well however I keep getting the same error message",0
"But yeah if you absolutely must do that, multiply by 0.01 ;)",0
@SamanthaAtkins Because the origins of the client and the server are different. You can't just let a website request some random server for security reasons.,0
"Thank you! That works. However, when I do use that value, it says it's private: &quot;The resource @dimen/m3_bottom_nav_min_height is marked as private in com.google.android.material:material:1.5.0&quot;. Is that going to create any issues?",0
given this code example the only reasonable inference is that `x.q` will be set (thought it can be set to `undefined`). There's no guarantee here that `x.p` or `x.h` are defined.,0
Im receiving user/order data from a platform to deploy a personal subscription with some basic resources. I then send the data from my Logic App do DevOps and then trigger a YAML Pipeline where I'm filling my values into the variables. Two of the values are start and end date which are needed for a Budget to monitor the deployed subsciprtion. Back to the specific Problem. The Body I'm sending from my Logic App to DevOps contains all values (initialize variables). A part of the Body you can see in the attachement,0
"@Alex It's working with map. However, I tried flatmap as well. Both work fine for my expected result.",0
Don't forget to create proper HTML: append rows to their respective  `&lt;thead&gt;` and `&lt;tbody&gt;` elements,0
"If you are using `composition api` in your component, you don't have access to `this` keyword, instead you should import store before using it. [vuex](https://vuex.vuejs.org/guide/#the-simplest-store)",0
The original string bytestring can be passed into `ast.literal_eval` and a bytestring (`bytes`) object will be returned.,0
"This just adds an aggregation that shows the min value, which btw already exists in inner_hits. I need to *filter* the returned documents based on that value, not just show it.",0
"Yes, and thanks in advance, I'm trying to automatically detect the code in the celles and change the font formating and coloring accordingly like any IDE or Code Block addon",0
"Oh my goodness, thank you so much. I just put it all together.  I understand how the algorithm works, and I watched tutorials on recursive backtracking. Though I was misinterpreting how a recursive call works. Your explanation of call stacks just made me realize why it actually is backtracking and how I should solve it. Thanks.",6
Does the section with the title &quot;Repository cleanup&quot; in the manual help? https://docs.gitlab.com/ee/user/project/repository/reducing_the_repo_size_using_git.html#repository-cleanup,0
@miken32 the `data` has keys `{cart_street_addres}` is the same as `{cart_street_addres: cart_street_addres}`,0
Please checkout this one https://stackoverflow.com/questions/71110785/axios-post-sent-request-twice/71110880#71110880,0
@jeni I'm not yet that experienced with cnn and have no advise about resizing or cropping. Please create a new question with a specific issue so that others can participate! The strength of Stackoverflow is that a lot of different people with different expertise will look at it. Keep in mind that you should repare your question to be as specific as possible. Then you will get a quick and specific answer.,0
"Ah, so *that's* what was meant in the OP...",0
"Sadly, I feared that filtering after finding all cycles would end up being the way to go. C’est la math.",0
"https://datascience.stackexchange.com/ is more appropriate for design questions, SO is for programming questions. In short: POS tags can give some indication about predicting orders for example, but even this would not work very well in general. Predicting sarcasm is extremely challenging: it's an active area of research, which means it's not solved even with very complex models. it's certainly not doable only from POS tags.",0
Yeah still missing this feature.,0
"@derpdewp It's not a problem for one file. I've tried hundreds, and no it's not a path separator issue.",0
@knittl Doesn't help since it uses diamond operator which is being introduced only in latest java versions. Please advice,0
This is it. This is the hint that I needed.,0
"${user.dir} worked very successfully.&#xA;&#xA;Unfortunately ${file.separator=='\\' ?/:\\} didn't work, but ${file.separator} worked instead.&#xA;&#xA;Thanks for your help.",0
"Are you on **macOS**? It looks like the code is wrong at this line `args += [&quot;-R&quot;, f&quot;{left},{right},{right-left},{bottom-top}&quot;]` and it should be `args += [&quot;-R&quot;, f&quot;{left},{top},{right-left},{bottom-top}&quot;]` You should be able to work around it by copying the code and running `screencapture` in a `subprocess` yourself.",0
Can you clarify which exact line in the shown code is &quot;adding it with 0xFF&quot;?,0
"Ok got it, still this procedure sounds new to me but I'll search for some more information!",0
kindly help me out of that,0
You are right. I edited my answer to avoid creating any new tensor.,0
"A faster way of doing your pivot would be: `df.set_index(['sale_id', 'item']).unstack()`",0
or maybe send the child with arguments,0
"Does Kendo-datepicker have a placeholder attribute you can edit? Just a thought, I have never used it before.",0
"RARS doesn't have 64-bit integer input, even when 64-bit processor setting is enabled!  So, yes, you have to do it yourself from string/text.  RARS also offers virtually no library support, so there's no `atoi` and no `atol`, thus you're really on your own to write that.  You'll want to do the basic arithmetic of an `atol` algorithm in 64-bits which is a minor burden for a 32-bit processor, and @Peter gives a number of suggestions as how to do that.  Further, you may or may not want to check for overflow in 64-bit arithmetic (ideally you would).",0
"Hmm, ok . But are you then rejecting some of the objects in ``calibres_prix`` ? because the length of this variable isn't the same as the other one .",0
"Your question is a duplicate of https://stackoverflow.com/a/66831280/1597430&#xA;In short words, this is not CSV.",0
"Docker on its own doesn't &quot;know about&quot; HTTP in any useful way, and won't change the caching behavior of your application.  This is a pretty generic Dockerfile for a Python application; can you [edit] the question to include a [mcve] with enough details to reproduce the issue?",0
@DanMoore PO are on the related record list or in some standard NetSuite field on your SO?,0
does [this](https://stackoverflow.com/a/68420874/3585796) answer your question?,0
"Just to be clear: when you submit the whole page, the changed data in the inputPassExpiryDate field is not visible on the server? Have you checked in network properties whether the content is sent as part of the post?",0
