Post Text,Score
"It does show something for me… It's not a number, but why this happens should become clear if you replace `toString(pi_digits.next())` with `JSON.stringify(pi_digits.next())`",0
Thank you! I thought it means machine learning.,0
"And the page title is not hardcoded anywhere, put output dynamically. If you want to manipulate it, you should look into the WP _filter_ system; `wp_title` would probably be the one to use here.",0
Your code is partially working. I am unable to deselect. I tried the above code u gave,0
"@user1934428 also, the docs for `&lt;&lt;&lt;` read: &quot;The result is supplied as a single string, with a newline appended [...]&quot;.",0
"Inspect your site and set the first value input field to whatever it is, otherwise the page refresh won't work.",0
@ApacheOne good luck - see edit and make sure you replace the whitespace for actual `NA` values,0
"`node --print &quot;JSON.stringify(Object.entries(http.STATUS_CODES).reduce((acc, [key, value]) =&gt; (acc[value.replace(/ /g, '_')] = key, acc), {}))&quot; | jq '.'`",0
That's perhaps an indication that it's not executing what you think it is.,0
"@crunker99 Yes, tried adding __init__.py inside dags directory. Did not help.",0
"thanks, tried that approach working well with same format('yyyy/mm/dd'.), but my field price has two different input : min_price and max_price",0
"no, unfortunately I only receive the file in this format",0
There is no `textarea` element in your example. Not sure what you are trying to Clone.,0
"I believe the first statement would be fine if you removed the `escape = '&quot;'` or made it `escape = NONE`.  The issue appears to be that your escape and your field_optionally_enclosed_by are the same character.  Based on your example, you don't need to define an escape character.",0
"No, the correct way to do this would be to have an interface specifically for this, like `ICanGoInGarage`, which may itself also implement `IVehicle`",0
"Note that this line of code is slightly outdated with regards to current use. [Here in the documentation for PyPDF](https://pypdf2.readthedocs.io/en/latest/user/migration-1-to-2.html#imports-and-modules) it states: &quot;PyPDF2.pdf no longer exists. You can import from PyPDF2 directly&quot;. So the line should now be `from PyPDF2 import PageObject`. Otherwise, you get the error `ModuleNotFoundError: No module named 'PyPDF2.pdf'`.",0
This solved my problem for Android Studio 2021.2.1 as well!,16
@robertklep Now I got your point! Thank you for the explanation.,0
"@gaut Should do so, It avoids the a comparison.",0
Can you please clarify,0
Xamarin Android uses Android API and UI written in C#. Xamarin iOS uses iOS API and UI written in C#.  Xamarin Forms uses a cross platform API/UI layer written in XAML/C#.  XF is a separate project type in VS,0
once `stdin` sees `EOF` it stops.  trying to find a duplicate.,0
"This good way, but for single field or entity.",0
You can use `$router` to push a query and `$route` to get the value on your page as shown here: https://stackoverflow.com/a/68149917/8816585,0
"I don't get what you want. How many hosts are in the play, just 1, or 5?&#xA;If so, do you want each host to be aware of another hosts' role? Describe your end-goal, preferably w examples.",0
"Thanks @Dennis Alund for your post. The problem here is after signout from our application, automatically we have to stop using apple account for our application. Able to revoke the access manually after we sign in to apple.com and select SignIn with Apple and stop using account. This we have to do programatically instead of manually.",0
"@sophia you're linking to the API doc of AbstractMap, and it says &quot;many implementations will override this method.&quot;, which HashMap indeed does - nobody would use it if it did't improve the performance of this key operations to something better than the (abysmally bad) O(n). And if you compare the implementations of HashMap.get() and HashMap.containsKey() you will notice that they are, as I wrote in my answer, identical except that the latter only checks whether the result is null null instead of returning it.",0
it's just no messages in Log,0
https://stackoverflow.com/questions/73345595/getting-mouse-and-keyboard-input-in-console-application-c-sharp Maybe check this related issue.,0
"It is a known issue, see here. https://github.com/dotnet/aspnetcore/issues/9039",0
"@jdweng all my permissions seem fine, i can create and delete files in explorer fine, and the app itself created them just minutes before",0
Because spring first looks up configuration class and then others class of bean annotated by `@Component` etc. So we need looks up first `CustomReadinessStateHealthIndicator` and for sure `before = {AvailabilityHealthContributorAutoConfiguration.class}` because AvailabilityHealthContributorAutoConfiguration make main bean of this type Indicator.,0
"@RyanCogswell I mentioned that above -- `userEvent.click` calls `mouseDown`, so that part's okay. I was clicking the wrong element though -- it needs to be the `button`.",0
In modern Python you'll get: `TypeError: 'dict_values' object is not subscriptable`. This works instead: `random.choice(list(dictionary.values()))` But this is handy in that you can sample different arbitrary elements.,0
I obtain an error in Perl 5.34.0: (?&lt;atext&gt;           (?&amp;ALPHA) | (?&amp;DIGIT) | [ &lt;-- HERE !#\$%&amp;'*+-/ at parsing-test.pl,0
"@Luuk Sure, I will add some queries with that regard, but I guess I dont have a good query in that sense",0
Save the time as UTC time then convert as necessary.  If internally you always use UTC and only display (or input) in the local time the code becomes much simpler.,0
"Thank you so much! Being a newbie in Django, I didn't know about this method and how it works. You pointed me in the right direction and I was able to solve the issues that had me stuck. Have a good day and thanks again for your time.",0
"Hey mozman,&#xA;&#xA;thank you very much for your answer! Unfortunately the page_setup is still not affecting the properties of the layout. Neither the margins nor the size ist changed. I am using Qcad Professional to open the file. Is there anything else I could check?&#xA;&#xA;Greetings",81
Can you not use the radio button instead ?,0
I did not get it running with the &quot;normal&quot; Nginx but your side note with Nginx Proxy Manager was the perfect solution and solved my problem.&#xA;Maybe I had another mistake with my Nginx configuration which I do not need with the NPM :) &#xA;Thank you so much,0
"This didn't work for me, but it sure did help me get closer to the answer that I needed so thank you. The two things that weren't working (it may have been misunderstandings on my part) were that the code seemed to apply to any cell that I happened to have selected, rather than only the cells that dealt with end time; and it would only modify the cell when I would select it, instead of when I was deselecting it. Again, it was still a big help.",0
@GabrielPichot Why not? It is a method of the window so it should not make any difference,0
"Hi, thank you for your reply, followed your instruction, I finally got ... new error. It shows `Upload completed successfully &#xA;Deployment completed successfully.&#xA;Syncing triggers...&#xA;Functions in liborwebapi:`&#xA;&#xA;and then I go to the functions to check, it shows:&#xA;`Your app is currently in read only mode because you are running from a package file. To make any changes update the content in your zip file and WEBSITE_RUN_FROM_PACKAGE app setting.`",0
"Actually disregard my prev comment and just do this:&#xA;`var listGrouped = list.GroupBy(x =&gt; x.Category).Select(x =&gt; new AnimalsWithExamples(x.Key, x.SelectMany(x =&gt; x.Example).Distinct().ToArray())).ToList();`",0
"Also, you are using `join` wrong (probably, depending on what you want to do). The correct use is `separator.join(parts)`, so you join the characters `/` and `*` using your original path as separator, getting that `//...*` path.",0
"It's making a commit, and a branch—ten of them—of content you've never really checked out. The just-this-once work trees aren't affected at all, you're just collecting content snapshots to build a workable history from. `git reset` to reset your index afterwards, then you can check out the branches normally and construct a more useful history from the ten-unrelated-deployments history you just constructed.",0
@HaveCompiler--WillTravel I'll answer with a quote from Grace Slick: &quot;Go ask Alice...&quot; `:-)` &quot;Feed your head! Feed your head&quot;...,0
"This works for IAM policies resource patterns (because, well, they are ARN patterns, not ARNs). This doesn't work in other situations where the exact ARN is required. e.g. the `ValueFrom` property from the `Secrets` section in a container definition of an ECS task definition requires the exact ARN ([reference](https://docs.aws.amazon.com/AWSCloudFormation/latest/UserGuide/aws-properties-ecs-taskdefinition-secret.html)).",0
Or this: https://learn.microsoft.com/en-us/dotnet/desktop/winforms/controls/add-and-remove-columns-in-the-datagrid-using-the-designer?view=netframeworkdesktop-4.8,0
"Wow, nice idea. Please, can you give an example on this.",0
What exactly do you mean by &quot;*it keeps loading and doesn't work*&quot;? Any error messages? Did you confirm your route handler is called? Are you getting the log from the `listen` callback? Make sure not to ignore its `err` parameter but log it!,0
How would anyone know &quot;how likely I will encounter it today.&quot;?  My guess is 0% chance but that's not really a technical question but an opinon.  I would argue there is a 1:1 mapping between your perceived problem and `NULL != 0`.  Of course I could be wrong.,0
"Ok, both work now, so I edited the answer, and I leave it here for others. Thanks!",0
"It’s obvious from that output that your statement &quot;*I installed node using homebrew.*&quot; is not entirely true, no? Why keep trying to uninstall it with brew if it’s not there to begin with…?",0
"Regarding using a request xml body vs query string URL would depend on the API you are calling.  Usually with POST or UPDATE you would be using a XML body, but for GET and DELETE you would most likely use a query string.  Although sometimes you use both a xml body and a query string.",0
I'm trying to rule out all the inputs that are likely to lead to 0 outputs,0
"I agree with you - but to prove your answer I did the easy way and changed the classes to string, and that worked - so your answer is right.  Now I have to figure out why the ID in the base class is a string, when it is an integer in the array...",0
https://flask.palletsprojects.com/en/2.0.x/appcontext/,0
"thanks for the answer i have too double check it to make it run but i hope you can tell me, since i am using numerical and no text what does vocab_size should represent?",0
"i'm not seeing the benefit of approach 3. additional queues for what? additionally, if the in-memory queues go down you loose your messages. i have 16 partitions, and the ordering matters (i need to consumer events in the order they are inserted into kafka)&#xA;&#xA;. you talk of worker threads, but if you have less consumers than partitions your consumers will act like worker threads as they service different partitions.&#xA;&#xA;also, in approaches 2 and 3, how would you de-duplicate your data. have a fact store for each consumer (likely with some timeout so you don't keep the message ids indefinitely)",0
"If you're using only one origin and one destination, what you should use is the [Directions API](https://developers.google.com/maps/documentation/directions/overview). Distance Matrix API is for multiple origins/destinations request.",0
Or try https://stackoverflow.com/a/64885552/4997994,0
You're welcome. Your question piqued my interest. I'd run the bash script on my local development machine but you could run it on an Linux VM with `gcloud` installed including Cloud Shell. Just be mindful that it creates a Service Account key so you should treat that with care.,0
"@MichaelPetch Thank you very much!!! Just as expected it's a stupid problem, can't believe I didn't notice it...... QAQ. I must be too tired these days.",0
Now I get the error &quot;For-in loop requires 'EmptyTransmittable' to conform to 'Sequence'&quot;,0
Thanks that's helpful.  hashinclude is a utility I made to add cache-busting hash values to CSS / JS includes.  I'll test with just &quot;echo&quot;,0
"or `pd.concat({'DF1': df1, 'DF2': df2}, names=['DF number'])`",0
"You don't need `logfile.close()` since `with` does that automatically. And `grocery_list.close()` isn't even inside the `with`, so the file has already been closed.",0
"@WolfgangAmadeus, I see what you are getting at, but then you cannot get an array like the asker is looking for, so we must assume `code` is defined at every step of the chain. Secondly, that proposed stop condition would then need to still get that last step included (not excluded).",0
also tried `ls -1 | jq -Rn --arg prefix &quot;yourprefixvalue&quot; '{ listoffiles: [inputs | { file: &quot;${prefix}/\(.)&quot; }] }'` but that prints $prefix as literal.,0
I mean for a given project how can I get the p/parent location,0
There is a simpler way to doublequote values: https://www.javadoc.io/doc/org.yaml/snakeyaml/1.19/org/yaml/snakeyaml/DumperOptions.html#getDefaultScalarStyle-- but in general I agree that better to compare parsed values...,0
Does this answer your question? [pyspark collect\_set or collect\_list with groupby](https://stackoverflow.com/questions/37580782/pyspark-collect-set-or-collect-list-with-groupby),0
Remember you'll get a prompt on VSCode for adding your password. But you have to add your PAT instead. Thanks!,0
Is `Set` can keep the order of the data?,0
"It's not the order. In the first one, you are using `BrowserRouter` as `Route` and importing `Router` from `react-router-dom` which is incorrect. You should import `Route` from `react-router-dom` and `BrowserRouter` as `Router`.",0
"Anyway, if your final goal is a boolean (does the site use any analytics or not), then the URL of the site itself should be enough to prove that it does, because that initial `.html` payload must have one of those substrings in it if it shows up in the result array. If you try https://example.com you should see an empty array. Notwithstanding the aforementioned race conditions and being blocked as a bot.",100
"This is a nice information. Can I ask one thing - What is difference if I am loading the URL when the window is not visible and when the window is visible can it show the content since the Chrome Browser already got the address. &#xA;&#xA;After using this &quot;about:blank&quot;, intermittently that old data issue is happening. The last address before any new visibility is &quot;about:blank&quot; only, then how can it show the old data.",0
"Looking at your code and based on your reply to me, I highly recommend you review the links I supplied previously.",0
@gog That's an impressive tip. Updated.,0
"don't know why this is happening. Best to ask a new question about this specific problem. Make sure you include a reproducible example code, when you ask the new question.",0
@P.b That is limitation of `FILTERXML()` but in some case it is really nice.,0
"Documents folder but that should not be the issue as it called the test.xlsx from the documents folder just fine when it was a static file. What I'm wanting to do is leave the location as is but not have the file statically named: test.xlsx. For example, if I had a excel file named &quot;2020 purchases&quot;, it would read that file or any other file that is named in textbox 4",0
"You can avoid the current approach of hardcoding each loop which starts with this line `if (numeroDeConvidados == &quot;&quot;){ agenda.createEvent(title, chegada,saida).setDescription(descricao).setColor('3');};` by getting the guest information in a loop.  All of this may be a bit challenging for you but when you return you should be able to provide an [mcve] that we can use to assist you further.",0
"Yes, introduce/override: `ZodiacType#toString()`, which (does:)`return description.name();`",0
"Adding three letters like DTO, to the class name makes code much more readable comparing to using FQN. It's quite common to add suffixes like `Map`, `List`, `Query`, `Table`, `Service`, etc. to make the purpose of the class clear, and that's perfectly fine. We are engineers, we know what DTO is. But we need more time to understand what's the purpose of &quot;Car&quot; class(is it a table? is it a DTO?) comparing to the CarDto, which is clear by the first glance.",0
one thing here: this will only work on client roles and not on realm roles.,18
@Ja a comment not an answer,0
At least include the definition of the variable `transformer`,0
Type 'Notification' has no member 'Name'. I got this error in Xcode 14.0,0
"For small [`Copy`](https://doc.rust-lang.org/stable/std/marker/trait.Copy.html) types that fit in one or two registers, it's just as efficient to dereference beforehand and pass them as values. Doing so simplifies the usage of such functions by eliminating the need for borrow checking.",0
Can i see ur code? I mean entire code,0
this is not general but only for ListBox,0
How do I paste it in text format? I have tried to do this before an had issues with the formatting,0
"@DavidMaze sorry for not providing much details, depending on what would be helpful I can try to give more. We already have single images for each environment though, the hassle is contacting the devops guys everytime we add something, and other squads do it too. But you're saying we should provide the values at the docker run step instead? That may be worth looking into...",0
"@traveh: &quot;*my case is a bit more complicated with multiple virtual inheritance*&quot; Irrelevant. You cannot logically swap objects of different types. I mean, you can make it technically work, but you've stepped far out of the domain of what &quot;swap&quot; is supposed to actually mean.",0
A good paper about generalizing these is &quot;Tail Recursion Modulo Context – An Equational Approach&quot; (https://www.microsoft.com/en-us/research/uploads/prod/2022/07/trmc.pdf),0
"I am using react 18 version, I just want to hide navbar from student page ignore the switch statement, I tried but didn't get the correct output.",0
Works great and messages appear with no problems/errors. The only thing is that I can't see who sent what message but if that's too hard then don't worry I can just deal with it.,0
I've updated the question and the code,0
"You can use a macro: `#define FREE(p) do { free(p); p = 0; } while(0)` but I question whether it's really a best practice to zero pointers when they're freed. The best practice is to develop a coding style where use-after-free is avoided, for example by making ownership clear.",0
The question states that it's WinForms.,0
"And how can we add permissions that a package needs but doesn't provide any `RequestXPermissionAsync()` function ?&#xA;I'm trying to use [a wifi p2p lib](https://github.com/kirillzyusko/react-native-wifi-p2p#startdiscoveringpeers) and I need differents permissions such as `ACCESS_COARSE_LOCATION`, `WRITE_EXTERNAL_STORAGE`...",0
I found out somthing. I was reading my data from an excel sheet. When i saved the data as `csv` i noticed the cells that didnt convert to numeric have this `&lt;ff&gt;' beaside the number (i dont know here this came from!). I then used `gsub` to get rid of it and then converted to numeric with no problems. Thank you so much!,0
"Just to be able to wrap my head around this: you're scraping medical cabinets list (4 pages), and for each of them, you're following the link to their own website, and get the title and image source? Aren't those supposed to be all websites with a different design, where page title is not necessarily a `&lt;h1&gt;` tag, and maybe the logo is not the first image in page?",0
"A JPEG is already a compressed (lossy) format. You're not going to get more out of it without losing more quality. Why do you need to make them so small? Do they need to remain images that are readable by general image software, or can you use a zip file?",0
I have already tired `autoload_paths` it doesn't work. Also my understanding is that Rails will autoload anything under `app` directory so that should not be needed.,0
"@hochl: According to the article, the data in the tables shows that aligned fetches are faster.  My point is that extra work is required for unaligned data.  Not only are multiple fetches required, the processor has to do some bit manipulation to get the data into the proper place in its word/register.  This takes time.  Whether the time savings is significant or not is an opinion.  In time critical, embedded applications, there are times when this is significant (such as the accuracy of a 1ms ISR or reaching critical events).  So, unaligned is slower by his data.",0
"There are 2^n subsets of a set. If you're producing 2^n distinct lists as part of your function, you can't possibly do that in faster than `Θ(2^n)`.",0
"`With this array, you can apply the function strpos()`...this makes no sense. strpos searches a _string_, not an array. If you're going to suggest doing a simple string search for the value, it would need to be done on the original JSON _string_, not on the decoded array.",0
"@cyberbrain I tried to debug that, but never faced those calls at the same time",0
Note: wiredep is abandoned.,0
"its not actually sort on a single character, the condition is to sort on length then if the length of both the strings are equal then the string having more As should come first",0
You are correct about the trying to use Linq in the binding.  It won't work.  Rethink the design.  With little real context it's hard to suggest what might work.,0
@in-just MCVE = Minimal Complete and Verifiable Example. &quot;It did not work&quot; means nothing.,0
"Functions are always pointers at the assembly level. `&amp;add` and `add` are the same. But, you do not return a pointer anyway. You return a `std::function&lt;int(int, int)&gt;` which gets initialized from `&amp;add`,  i.e. `add`.",0
i would suggest [vite](https://vitejs.dev). `create-react-app` is an artifact of web development before browsers supported [es modules](https://developer.mozilla.org/en-US/docs/Web/JavaScript/Guide/Modules).,0
You are right. I got an exception for indexoutofbound. The flow of the class is wrong. Thank you very very very much.,0
`GoogleApiClient` and `LocationServices.SettingsApi` are Deprecated.,0
"... and similar UB in `scanf(&quot;%d&quot;, &amp;id);`. Consider making `id` an `int` rather than a `char`.",0
@CommonsWare&#xA;Besides all the normal online examples and a Java book from a one of my undergrad classes I have taken one on-line course from www.udemy. The &quot;Android App Development Master Course with Java | Android&quot; course a great refresher of Java and a OK introduction to Android coding.,0
"I've thought about that, but I still have no idea how to implement it",0
"Thank you for the other ways to solve the problem, I understand now that I must use the return keyword if I'm using the curly brackets inside the arrow function in the method, I was confused, thank you for clarifying!",0
There is also the option of using `extend self` in the module to make the methods callable similar to `module_function`. And I think the OP's issue with the module not found when defined in `lib` is probably due to it not being auto-loaded.,0
"both nr3 and nr4 use a cluster with export data frame and libraries, but nr4 appears to be faster than nr3. The difference is that, at least in appearance, nr 4 uses 2 clusters. I believe you when you say that there is nothing to be gained with two clusters, as I am not familiar with parallelization. I was just wondering why there appears to be a gain. Thank you for your replies!",0
But how will it give `response` body,0
"Do you want to make multiple REST Calls (one for each JSON), or do you want to make one(!) call with some sort of aggregated JSON?",0
"With macro you don't need to `catx` the `SET` name.  Macro is literally source code replacement when symbols are resolved, so do `SET &amp;sel_lib..&amp;sel_tab.;` (double dots are correct.  One dot to end the macro variable resolution, and the second literally the dot separator)",0
"You want the function to print different things depending on the architecture, but you don't want &quot;to *hard-code* the function to check the architecture and print the output accordingly.&quot; [italics added] What alternative can you possibly have in mind?",0
"When I tried this, it only seemed to work for auto-generated columns.  Non-auto-generated columns still appear blank for me.",0
https://pypi.org/project/pigar/ -- https://pypi.org/project/pipreqs/ -- and maybe others...,0
"Any `df` call should be with brackets, so: `a1&lt;-which(df()[,1]==&quot;Basic Info&quot;)+1`, `b1&lt;-which(df()[,1]==&quot;Body and Dimension&quot;)-1` and `df() %&gt;% slice(a1:b1)`, have you tried this?",0
 Please consider not posting [images](https://meta.stackoverflow.com/questions/285551) of code or data.,0
yes its working fine,0
find out the coorelation,0
"hi @raiph, thanks for your kind words. I don't exactly know why it is the way it is. I can speculate though :) It's better practice to pass around structs by reference in C especially when they are large, as pass-by-value copies the entire thing and not only speed is lost but also function's stack may overflow. With a pointer both of these are no longer issues. However, it makes the struct `is rw` on C level :) [contd]",0
