Post Text,Score
"My understanding—which is very vague since (I repeat) I have never actually *used* `repo`—is that you run some repo command to build a working tree. You then run `make` or whatever as needed *in* the working tree, make changes as desired, and then run various `repo` commands that in turn run multiple Git commands to commit changes into the various Git repositories via some repo-specific rule-sets that one would learn about when learning how to use `repo`. The goal of all this would be to *pretend* that there's a monorepo made up of all the individual repositories.",0
`array_filter()` will happily receive `strlen` as a callback string.,0
"As a stupid alternative you can initialize dicts where keys will be all possible permutations of given tuple, assign same function to each and join them: `dict.fromkeys(permutations(('Put', 'Put', 'Call', 'Call')), FunctionOne) | dict.fromkeys(permutations(('Put', 'Put', 'Combo')), FunctionTwo)`.",0
"Thanks so much for your help, i was able to  obtain the expected results. As the data was HH:MM:SS  all the time Day will not be filled.   Thanks!",0
maybe you should install `jupyter` in `Python 3.7` and - `pip3.7 install jupyter` -  use `python3.7 -m jupyter` to run it.,0
"json_TABLe is only valid for mysql 8 in its later versions, mysql 5.7 doesn't support it",0
"So, I see in your settings file, you have host set to &quot;/cloudsql/connectionstring&quot;. connectionstring isn't expanded anywhere, so I'm guessing you just didn't update it? You need to set that connection string to the right unix socket connection string for the db engine you're connecting to. Check the documentation for the right format. If that's it I'll create an answer for you to accept.",0
i see. then what shall i use instead of return,0
"You could use gunicorn to create two different instances one for each environment and then use nginx to route to the right server. Of course make sure they are not sharing the same database.&#xA;&#xA;I would though recommend to have a dedicated instance for each, you would normally want to have your production server running in isolation so it is reliable and secure. For example, if there is an issue with your beta server it might ended up bringing your production server along.",0
"@DrewReese it adds the `&quot;active&quot;` class by default, w/o needing to use the `className` as a function, try adding another class. It's possible the `Disclosue.Button` isn't changing the `className` behavior even with `as`.",0
"Hi, thank you for your solution. Is it possible to exclude a few fields with this workaround?&#xA;For example, I may only want to display `CustomerName` and `OrderID`.",0
"Hi.. @Amin Hossain, I have tried the code suggestion you provided and it works! the silly things is, the **undefined** maybe my mistake is on my route, the route is same method and uri. And actually there are still many missed or wrong code before you suggest. Thanks dude I really appreciate it",0
"`anyone that can get their hands on it`...should be only the user of the browser, unless the site is vulnerable to XSS attacks or anything",0
I'm having the same problem with latest release 20.10.17...,0
It sounds like you have a lot more issue than just being able to delete these tables. What is going to happen to the data that has a foreign key to these tables after you drop them? Are you just going to keep the foreign key values and no longer use them?,0
"Thank you so much, everything works now as expected. I tried to install GDB on my M1 Air through Homebrew but it states that it's not compatible on ARM: &gt;&gt;gdb: The x86_64 architecture is required for this software.",0
"I believe @Suncatcher was asking about where in the system you see &quot;transportation and accommodation allowances&quot;. The reason is that there are several ways how you could implement such things in SAP, and depending on how it was implemented, you would access it in different ways.",0
"My problem now is i don't now how to add a new tag_id instead of replacing the old one, example: from {tag_7z8eq87} -&gt; {tag_7z8eq87, tag_7z8eq72} instead of {tag_7z8eq87} -&gt; {tag_7z8eq72} @a_horse_with_no_name",0
@Robinson returning `null` when there's no join is the only purpose of an outer join.,0
You need to clarify what you mean by the &quot;correct slope&quot;.,0
"@luca112358 - Can you show me the implementation of pchar?  My psychic powers suggests it's not calling printf but perhaps bypassing the C runtime and doing something like `write(1, ...)` to flush its character buffer immediately.",0
@vanowm I figure out problem now thank you,0
I have had an exemple (link),0
"Thank you Akina. I am using MySQL 8.0.22. Furtheremore, at the end of my question I have added a sample data with CREATE TABLE and INSERT INTO.",0
"Have you tried anything from the dupes? [1](https://stackoverflow.com/questions/64314346/puppeteer-bypass-cloudflare-by-enable-cookies-and-javascript), [2](https://stackoverflow.com/questions/71923946/cloudflare-bypass-with-puppeteer),  [3](https://stackoverflow.com/questions/68696073/puppeteer-cloudflare-websites-return-403-forbidden), [4](https://stackoverflow.com/questions/55678095/bypassing-captchas-with-headless-chrome-using-puppeteer/55714786#55714786) etc. For example, you could start by adding a user agent.",0
"@fulvio - Like the earlier comments say, you are not learning assembly here, you are learning *gcc inline assembly*, which has a myriad of odd rules and conventions - **totally** different from the rules you need to follow when writing assembly in a separate asm file. Instead of learning the processor instructions, you now know some secret incantations for the compiler, that a separate assembler doesn't use. So, you are trying out some chinese as preparation for writing a book in greek? :-)",0
ye changing id to let from var works. Thanks!,0
"Unfortunately there's no much I can provide here as 1) all seems fine, if you have the mentioned permissions ... and 2) this requires some analysis from the support team; my recommendation is to reach out to them, so they can help out: https://jira.getxray.app/servicedesk/customer/portal/2",0
I use ajaxStatus in all of my projects and have never seen an issue with it. Please see if you can create a reproducer using https://github.com/primefaces/primefaces-test,0
It says root `composer.json` remove the one in root.,0
`addEventListener` makes no sense. You should be using an event,0
For anyone trying to do this I found a solution here =&gt; https://codepen.io/mikeK/pen/VGPdyJ,0
"@pythonlearner Try the [Zetcode PyQt tutorial](https://zetcode.com/gui/pyqt5/) and/or the [RealPython PyQt Calculator tutorial](https://realpython.com/python-pyqt-gui-calculator/). There are [some differences between PyQt5 and PySide2](https://www.pythonguis.com/faq/pyqt5-vs-pyside2/), but they should mostly work the same.",0
"Thanks.  It's not something that will change very often.  In the short-term CNAME, long-term ALIAS.  The answer from @simmyk will probably do the trick.  It seems like a simple use case that I thought Terraform would be able to handle.",0
Can you look at this [similar thread](https://stackoverflow.com/a/50553020/18265570) which might be helpful for you.,0
"If you want to obtain one row with both the values which are obtained in separate queries then simply `SELECT (SELECT ...) AS salary_count, (SELECT ...) AS invoice_count;`.",0
"Don't build the future as the future: parameter in FutureBuilder. See the first few paragraphs of the FutureBuilder documentation, or see my video at https://www.youtube.com/watch?v=sqE-J8YJnpg.",0
"As long as your server has a POST handler for the same url, then sure. So: what server is this running on?",0
Have amended my answer.,0
"Nice but note that this relies on the sorted order of the group. This would make things more difficult with more groups or an arbitrary sorting order, and less efficient in case of a large number of groups ;)",0
@y.bedrov It's works if I remove section &quot;idea {...}&quot;,0
@JensSchauder By semantic difference I mean that is the difference just for easy readability or are there supposed to be implemented checks to ensure a OneToOne relationship.,0
"&quot;If you really don't know the keywords, documenting them is not an issue.&quot;  The person writing a generic function does not know the keywords, so they allow a dictionary for the person who does override the function. The person overriding the function knows the keywords, so they want to document them.",0
"Hi @jkb! So I was trying to store some user information like user id, password and email, so I could access it later prompting the user to type the information stored in 'stored information' function... basically ask the user to login in a website",0
"The improperly initialized values are huge, so printing them with 2 decimal places prints a lot of digits before the decimal point and 2 digits afterwards.",0
"I am not sure how many rows your data frame has, but in general iterating over your whole data is very ineffective and should be avoided (unless the operation is quite complex). If you have a small number of observations, this approach may be sufficiently fast, but for a larger frame it would be quite slow.",0
Please explain better your expected output,0
"The `lambda` assignment here is equivalent to writing `def util_func(x, y): return x[0] == y[0]`",0
"@MaPo Yes, placement new: `double* x = new (buffer) double;`",0
Try this Nuget library to simplify Ado.net code  : https://www.nuget.org/packages/Ado.Entity,0
quick question can we detect both click and drag. basically i have a custom layout that i can drag with offset and i need to center a perticular item on click https://gist.github.com/raghunandankavi2010/419ebac4ff7dd111697b86308ea0b20e,0
"Actually it's just a way to treat all boxes content consistently, this kind of setting usually comes also with frameworks/tools like bootstrap, normalize, material, etc. Since this snippet has no framework, I just set it manually. Depending on whether you are using other tools/frameworks, it's likely you have this already. Hope this answers you.",0
Does this answer your question? [How can I merge multiple commits onto another branch as a single squashed commit?](https://stackoverflow.com/questions/5308816/how-can-i-merge-multiple-commits-onto-another-branch-as-a-single-squashed-commit),0
"@BrianMStafford Thank you. Unfortunately the tools mentioned in the tutorial are long gone. May I ask you if the tutorial was specific to C#, or could it be used with VB.NET as well?",0
"The OP's problem is with spaces in the folder name, not in their environment name. I have a work-provided laptop and before I got it my user name was set to my first and last name with a space in the middle. I cannot change my user name. So all my environments will have a space in their path until I reinstall Anaconda to a different folder.",0
It worked for me. I suggest you re-install Python.,0
for telegram you could try t.me/yourusername,0
Have you tried setting a break when you are creating the SqlCommand and seeing if you're storing the data that you think you are?,0
"Don't compare strings to string when you want to compare integers to integers :) Assuming `$Table` contains a string representation of the timestamp (eg. `&quot;1659951541000&quot;`), the following should do the trick: `if(+$Table -le $unixTime)` - `+` will attempt conversion to a numerical type",0
To fix the issue OP should remove the action attribute from the form tag. How is it a comment not an answer when it solves the issue?,0
@KonradLinkowski just edited the post to include the expected output.,0
I added a console image,0
"What does subtracting `arb` from `arb` mean here, it's not a number? And what happened to `elephant` in the results? And why does `dog` get `Jas to Katy` and not `Gem to Katy`?",0
"Hey Ozan, thanks for your answer. Its a many to many relationship. Thats the reason why there is a extra table (RoleToUser). Same goes for  transaction and role.",0
"In short: the special syntax with maps and channels are backed by the language spec, you can't create functions that may be used the same.",0
&quot;As tabs&quot;? Do you mean that you use only one view and always change the page? Why?,0
oh nvm I can just fix it by adding some forumulas to the cell. Thank you so much!,0
"Found out because of you, but its not really well explained. I made a proper answer down there",0
did you try using &quot;SQL Runner&quot; and test some queries from any of your tables from BQ?  because it runs you can add that to a &quot;view&quot;  https://docs.looker.com/data-modeling/learning-lookml/sql-runner-create-queries,0
"it is work, but the value is not suitable, i.e. price = 500, qty = 1, result subtotal = 1000.",0
Did you dind the solution?,0
"Yes, It's what I was searching for. But because I don't use abstract class, It's not exactly the solution. But thank you for answering :)",0
"@Brits I think you are right, but I am not using delegate, I see in my version there's a function  `didReceiveTrust`. Is there a way to set a closure for this function just like it's done for the `self.mqtt.didReceiveMessage = { mqtt, msg, id in ... }` Your answer would be greatly appreciated. Also, with this untrusted CA scenario, Apple would reject this app?",0
Does this answer your question? [matplotlib plot window won't appear](https://stackoverflow.com/questions/13151514/matplotlib-plot-window-wont-appear),0
"I have it, but it don't want to work",0
"If you have any additional suggestions for improvement, I'd love to hear them.",0
"Ok, that should be good. Why don't you use the locals you defined for `email` and `api_token` if that's possible at all?",0
"There must be a way to change the arch to the arm, correct?",0
"thanks for the post, I'm still getting the issue reported in the OP, and my two `if` objects are wrapped in an `allOf` array obj as documented here:&#xA;https://json-schema.org/understanding-json-schema/reference/conditionals.html&#xA;any other pointers come to mind?",0
Thanks man for pointing me out to the right direction. This help me solve the problem.,0
"Thanks @Allan Cameron, what if I want to extract the entire row between those values including all 3 columns?",0
"@MikeOne I updated my answer, it saves, but it saves several objects, I wanted to save everything in a single array",0
it will look like this:,0
"df1 &lt;- structure(list(day = c(1, 2, 3, 4, 5, 6, 7, 8, 9, 10, 11, 12, &#xA;13, 14, 15, 16, 17, 18, 19, 20), observ1 = c(1, 0, 0, 0, 0, 1, &#xA; 0, 0, 0, 0, 0, 0, 0, 1, 0, 0, 0, 0, 0, 0), observ2 = c(0, 0, 0, 1, 0, 0, 0, 0, 0, 0, 0, 0, 0, 1, 0, 0, 0, 0, 0, 1), &#xA;observ3 = c(0, 0, 0, 0, 0, 0, 0, 0, 0, 0, 0, 1, 0, 0, 0, 0, 0, 0, 0, 0),&#xA;check = c(0, 0, 0, 0, 0, 0, 0, 0, 0, 0, 0, 0, 0, 'TRUE', 0, 0, 0, 0, 0, 0)), &#xA; class = c(&quot;tbl_df&quot;, &quot;tbl&quot;, &quot;data.frame&quot;), row.names = c(NA, -20L))",0
"it seems rendered on error output, but there is an error:&#xA;&#xA;```Shell Script -- curl -X POST --data-urlencode &quot;payload={'channel': '#notification-test-devops', 'username': 'Jenkins Build', 'text': &quot;[Blocked Production] master (master #16) &lt;https://jenkins.XXX.net/job/XXX/job/master/16/|View Build&gt;&quot;, 'icon_emoji': ':jenkins:'}&quot; https://hooks.slack.com/services/XXX/XXX/XXX (self time 589ms)&#xA;/home/jenkins/agent/workspace/XXX_master@tmp/durable-6305c906/script.sh: 2: Syntax error: &quot;(&quot; unexpected&#xA;```",100
"Same here, none of them works for me.",0
what should I call in the construct?,0
"@avery For extracting a column, you can use `$` or `[` or `[[` i.e. `df$disease` or `df[, &quot;disease&quot;]` or `df[[&quot;disease&quot;]]`.  I would use `[[` to avoid any surprises (as `$` can have some partial match issues and would not work if you are trying to call from an object or in a loop i.e. `for(nm in names(df1)) print(df1[[nm]])` works",0
"thanks, I'm making some tests",0
And what if there's more lines with the same ID?,0
"Hi Andy, your post correctly calculates the different test scenarios I ran. Very simply put, `nameCntMult` should be the value of the immediately prior row if the current row Code &gt; 0. If current row Code = 0 then nameCntMult is current row nameCnt * 2. I look forward to your update!",0
"Hi Michael, I'm sorry but I don't get exactly what the problem is. Do you need to add metafields to specify an attribute that is not already in the product? You can add metafields using the API but for filtering is better to use an app or create your own endpoint.",0
"@kedarsedai     yes am use MondoDB Atlas , pleas I need help with error I spend 3 day try to fix the error",14
I've added a [demo](https://godbolt.org/z/sWozvf59r) in the where the program compiles without any problem/error.,0
"@ArnoldZahrneinder fork the third party code. I needed this type of behavior in an `ldap` package which did not support context cancelation. The easy fix to the source was l in any blocking read functions, I monitored the context &amp; if canceled, closed the ldap connection &amp; that &quot;forced&quot; the reads to abort.",0
The / operation means 32 / 10 = 3.2. I'm new in programming domain and it just a small exercise to try. Thanks.,0
"The pattern base app and additional chunks in a separate repo sound interesting. But I don't see how can it happened. Let's say we can solve this dynamic routing problem but how can Vue know where the file of code to load when visiting a route? Because the file is placed in another repo so Vue has no information about it. So we have to end up by pushing all the code together. Then at that time, you don't need dynamic routing anymore, right?",0
"Shouldn't I simply consider this MP4 as corrupted, and ignore any problems happening around it? Are there often MP4 files like this one?",0
"@Code-Apprentice It can fail in case condition that triggers `logging.info` for the other two info messages would be triggered. I see it similarly like if you have `logging.warning` message in your code but your test case is not supposed to trigger warning message, you would include something like `self.LOGGER.warning.assert_not_called()`.",0
"1800 (30 minutes) is the current limit for synchronous HTTP requests. For longer jobs, consider Cloud Run Jobs: https://cloud.google.com/run/docs/create-jobs",0
"What is with this creating empty files thing? There aren't too many threads regarding this, but enough so that there should be an explanation already. Just had this issue with the command &quot;py&quot;, and, as now expected, and for absolutely no apparent reason, the empty &quot;py&quot; file was in the System32 folder.",0
See the second snippet [here](https://stackoverflow.com/a/18272025/2943403).  I still need to see sample data for `$invoiceItems`.,0
"@ekkis [`git prune`](https://stackoverflow.com/a/36083638/6309) would remove your local &quot;remote tracking branches&quot;, not your local branches. It removes `origin/xxx`, if `xxx` no longer exists in the remote repository.",0
"It is better to avoid using this approach for making a div container scaled to the screen. Instead, some CSS tricks can satisfy it better.",0
"Postgres requires c stringe so work stright with c methods avoids memory shortage, and  I am not really Expert with file streams",0
"So you can do `for i in iter(myIter):`. Again, why define an iterator if you don't want to iterate over it like that?",0
"Also, how do you suggest I add a new page and access its table? Currently I'm saving this docx first and then re-loading it. But I'd like to avoid that.",0
@StephaneVanraes Unfortunately it seems to only work properly if all elements that use the group binding exist in the same component. It may [behave like radio buttons](https://svelte.dev/repl/46683837b4c540f988d673571901603e?version=3.49.0) otherwise.,0
after a long time he gives me connection timed out,0
This will no longer be available from end November 2022 - Heroku is withdrawing  free accounts - https://help.heroku.com/RSBRUH58/removal-of-heroku-free-product-plans-faq,0
"With approach # 1, did you mean write to the database from which you source your records?",0
"Your code had issues far beyond the modulo operator, and one of those issues is what was pointed out in the answer.  Either one of the issues (uninitialized `j` or accessing an array out-of-bounds) can cause the program to enter undefined behavior land, causing the code to seem slow.  But as a comment already suggest, if this is so important, use a class that has been already developed for &quot;big integers&quot;.",0
"What is `mappa_id`, why are you including index in `.iterrows()`? The original data that you shared above was just names `name_1`, `name_2` etc.",0
I had to add shrinkWrap: true to make it work in my case,0
"Thank you very much - user56700. If I enter a character that is not in the list, I use try - except. I understand how to eliminate the error, it just wasn’t in the condition of the assignment, so I didn’t do it.&#xA;I also, like you, pointed out that you do not need to enter the alphabet with your hands, but generate it. But we haven't learned libraries yet, so I didn't know how to do it without using 'import string'",0
"@DanBaruch Can you elaborate a little bit, like how the edit text will work again after displaying the result like in Linux when we enter any command it give some results and then agains blinks for input ..",0
"@Charchit It was a good idea to try, but it did not make any difference.",0
I wish I could download a copy of their sample project but I couldn't find it anywhere.,0
"The sort of diagonal artifacts you saw are characteristic of having written or read image data with the wrong width, or byte-length-per-row (in this case, only very slightly wrong). This can come up a lot, and recognizing them can be useful.",0
I am facing a similar problem where starting up an MF causes a conflict of some MUI dependencies. This seems to create different instances of the the styling causing some of the components to be styled incorrectly. I feel we have a similar problem so I have added abounty to get more detail,0
"Yes, the key is to give the `add_header_above()` function a predefined **named** vector.",0
"@Atte I used default build/build.sh with the default soft-link **build.config**  link to **private/msm-google/build.config**. Thank Atte ,i solved it with this method.[link](https://stackoverflow.com/questions/73496127/build-android-kernel-with-llvm-hostld-ld-lld-lto-fatal-error-instruction-require)",0
"Hey ho, is there any fix yet? Im having the same issue.",0
what code did you run ? maybe it needs some extra settings in file `.spec` with Pyinstaller settings.,0
good points. I might check out the `base` project to see if this has ever come up in their issues tracker. @chi's idea might be a reasonable feature request.,0
Hmmm pickle is often a concern where it is being stored externally.  I'll take a look to see if this is still usable though.,0
"after adding the try-except clause for the accept button, it works. Thanks.&#xA;&#xA;What is the purpose of the last except clause?",0
What is MISRA and how to cook it: https://pvs-studio.com/en/blog/posts/cpp/0702/,0
"I got IntentsBitField to work somewhat, but I am still unable to receive or send out a message using the bot",0
"thanks! I just thought that there is some way to make a kind of stub for the attributes in the select, so that group by does not need to be added to group by",0
sorry i forgot to add the 2s delay in the snippet(i edited it in).,0
"Oh it's an arrray method now I'm aware thanks! I rarely use pop() method, but in this case it was just short for population. thanks again for your help!",0
"I don't think it does or that it's feasible at all, but I could be wrong. Some elements (like blocks or macros) may require some argument used conditionally. If there's no runtime variables passed it's impossible to evaluate the output.",0
`onPressed: null` and the popup opens.,0
Is it possible to stop event emitter?,0
"@MarkSetchell For username and status I can, but I will need to display numbers (as damage) that can be various",0
"In other words, the &quot;Distinct&quot; function is immutable. It doesn't modify your original collection instead it returns you a new List of distinct elements.",0
thanks @DaleK. &#xA;where do you see that suggestions message. I am not seeing it.&#xA;The two queries I posted does not show much difference other than the AND/OR/IN etc. but still it shows difference in total execution time. It uses the same tables and fields. almost same where clause part. &#xA;Will it make any difference if I add index?,0
I've already answer similiar question please check the answer [here](https://stackoverflow.com/a/73648247/18393222),0
"Could you please help me with the below details because with the given information it is difficult the find the exact issue. 1. Which connector you are using, Dynamic 365 or Dynamic CRM? 2. In which step you are getting the error, `Test Connection` or when creating the Linked Service? 3. Please share some snippet of what have you tried. &#xA;&#xA;From the error message, I can just interpret that the organization name in the Service URI isn't correct. The URI must be in this format`https://&lt;organization-name.crm[x].dynamics.com&gt;`. If the given URI isn't in this format, please check again.",0
"could you modify your code so as to also modify format of DT column, please? ;) I am not good in SAS",0
` const renderMovies = ({ item }) =&gt; &lt;ShowMoviesV2 movies={item} /&gt;; ` &#xA;sorry about forgetting this.,0
"@Dom thanks, it's the consequence of my hasty code reorganization for this answer. Fixed",0
Looks like the same behavior. It still bounced.,0
